uuid,Void/Retire,Fully specified name:en,Short name:en,Description:en,Data class,Data type,Answers,Members,Mappings|SAME-AS|PIH,Mappings|NARROWER-THAN|PIH,Mappings|SAME-AS|CBS,Mappings|SAME-AS|CIEL,Mappings|NARROWER-THAN|CIEL,Mappings|NARROWER-THAN|Rwanda HMIS Report 2012 01 20,Mappings|NARROWER-THAN|RWCS,Mappings|SAME-AS|RxNORM,Mappings|NARROWER-THAN|RxNORM,Mappings|SAME-AS|SNOMED CT,Mappings|NARROWER-THAN|SNOMED CT,Mappings|NARROWER-THAN|RSMS,Mappings|SAME-AS|ICPC-2,Mappings|SAME-AS|ICD-10,Mappings|NARROWER-THAN|ICD-10,Mappings|BROADER-THAN|ICD-10,Absolute high,Critical high,Normal high,Absolute low,Normal low,Units,Allow decimals,Complex data handler
8aadf10d-5c2c-46c0-b422-8ed83d7731be,,TENOFOVIR ABACAVIR LOPINAVIR RITONAVIR,TDF+ABC+LOP/R,Second-line drug combination used to treat HIV,Drug,Text,,,,2991;TENOFOVIR ABACAVIR LOPINAVIR RITONAVIR,,,,,,,,,,,,,,,,,,,,,,
5634523f-5da1-40be-95db-380e159fd652,,TENOFOVIR LAMIVUDINE LOPINAVIR RITONAVIR,TDF+3TC+LOP/R,Second line drug combination used to treat HIV,Drug,Text,,,,2992;TENOFOVIR LAMIVUDINE LOPINAVIR RITONAVIR,,,,,,,,,,,,,,,,,,,,,,
3ca5e860-a818-44d7-b986-893df2e85a98,,TENOFOVIR ZIDOVUDINE LOPINAVIR RITONAVIR,TDF+AZT+LOP/R,Second-line drug combination used to treat HIV,Drug,Text,,,,2993;TENOFOVIR ZIDOVUDINE LOPINAVIR RITONAVIR,,,,,,,,,,,,,,,,,,,,,,
b85ee495-4aaa-4037-82ec-ccb781df9741,,ZIDOVUDINE LAMIVUDINE LOPINAVIR RITONAVIR,AZT+3TC+LOR/R,Second-line drug combination used to treat HIV,Drug,Text,,,,2994;ZIDOVUDINE LAMIVUDINE LOPINAVIR RITONAVIR,,,,,,,,,,,,,,,,,,,,,,
e0410d69-7dc8-4709-b062-7a147a625b03,,STANDARD TUBERCULOSIS TREATMENT,,Marking ART patients in register as also receiving TB treatment.,Drug,Text,,,,2995;STANDARD TUBERCULOSIS TREATMENT,,,,,,,,,,,,,,,,,,,,,,
a5044c82-1ffc-45fb-81b3-4a4539f9bbec,,"NEW PROPHYLAXIS DRUG, OTHER NON-CODED",,,Drug,Text,,,,"3119;NEW PROPHYLAXIS DRUG, OTHER NON-CODED",,,,,,,,,,,,,,,,,,,,,,
4add1344-ec52-41e3-b5b9-267f19d99aa2,,CAPTOPRIL,,"ACE Inhibitor. Captopril is used to treat high blood pressure (hypertension), congestive heart failure, kidney problems caused by diabetes, and to improve survival after a heart attack",Drug,Text,,,,3182;CAPTOPRIL,,,,,,,,,,,,,,,,,,,,,,
44299055-6e5f-4548-af34-dcf5e13bb6a5,,LISINOPRIL,,"Lisinopril is in a group of drugs called ACE inhibitors. Lisinopril is used to treat high blood pressure, congestive heart failure, and to improve survival after a heart attack",Drug,Text,,,,3183;LISINOPRIL,,,,,,,,,,,,,,,,,,,,,,
65d46f90-9352-41c9-9705-38f67f097fdd,,ALDACTONE,,Aldactone is a potassium sparing diuretic that prevents your body from absorbing too much salt and keeps your potassium levels from getting too low.,Drug,Text,,,,3184;ALDACTONE,,,,,,,,,,,,,,,,,,,,,,
b4307c45-16dc-428a-b194-e6ed6470b264,,CARVEDILOL,,Carvedilol is a non selective beta blocker indicated in the treatment of mild to moderate congestive heart failure.,Drug,Text,,,,3185;CARVEDILOL,,,,,,,,,,,,,,,,,,,,,,
d53d1bc4-1b19-4c03-9aae-61e7662acc0e,,ATENOLOL,,Atenolol is used alone or in combination with other medications to treat high blood pressure. It also is used to prevent angina (chest pain) and treat heart attacks. Atenolol is in a class of medications called beta blockers.,Drug,Text,,,,3186;ATENOLOL,,,,,,,,,,,,,,,,,,,,,,
bc20d803-f368-4177-8b36-d1812a977ae2,,AMLODIPINE,,"Amlodipine (as besylate, mesylate or maleate) is a long-acting calcium channel blocker (dihydropyridine) used as an anti-hypertensive and in the treatment of angina",Drug,Text,,,,3187;AMLODIPINE,,,,,,,,,,,,,,,,,,,,,,
08b04285-6378-408d-9906-b4982b34f755,,POTASSIUM,K+,Potassium is an essential dietary mineral and electrolyte.,Drug,Numeric,,,,3188;POTASSIUM,,,,,,,,,,,,,,,,,,,,,0.0,
98649fa2-a68b-4bbd-b570-95a718a94924,,WARFARIN,,Warfarin is used to prevent blood clots from forming or growing larger in your blood and blood vessels.,Drug,Text,,,,3190;WARFARIN,,,,,,,,,,,,,,,,,,,,,,
5acfcca3-4fa7-4267-a149-ce0de9c6c69f,,"BENZATHINE PENICILLIN 600,000 IU IM",,"is slowly absorbed into the circulation, after intramuscular injection, and hydrolysed to benzylpenicillin in vivo. It is the drug-of-choice when prolonged low concentrations of benzylpenicillin are required and appropriate, allowing prolonged antibiotic action over 2 to 4 weeks after a single IM dose.",Drug,Text,,,,"3319;BENZATHINE PENICILLIN 600,000 IU IM",,,,,,,,,,,,,,,,,,,,,,
8140a4d3-3dac-4dca-9da2-17eb0f25e3ff,,BENZATHINE PENICILLIN 1 POINT 2 M IU IM,,"slowly absorbed into the circulation, after intramuscular injection, and hydrolysed to benzylpenicillin in vivo. It is the drug-of-choice when prolonged low concentrations of benzylpenicillin are required and appropriate, allowing prolonged antibiotic action over 2 to 4 weeks after a single IM dose.",Drug,Text,,,,3326;BENZATHINE PENICILLIN 1 POINT 2 M IU IM,,,,,,,,,,,,,,,,,,,,,,
8e2949d5-10dc-4bde-afd2-3fcc6b6df00e,,ISOSORBIDE DINITRATE,,For the prevention of angina pectoris due to coronary artery disease.,Drug,Text,,,,3428;ISOSORBIDE DINITRATE,,,,,,,,,,,,,,,,,,,,,,
d5c6e8f6-af32-4793-aab8-bd8cdbdbbcb2,,DIGOXIN,,"Digoxin helps the heart to beat more strongly and regularly. Digoxin is used to treat conditions such as congestive heart failure, atrial fibrillation, and atrial flutter.",Drug,Text,,,,3488;DIGOXIN,,,,,,,,,,,,,,,,,,,,,,
3db21aed-ca35-4c53-8863-53865d34a207,,BLEOMYCIN,,An antibiotic chemotherapy drug that inhibits cancer cell growth by interfering with the formation of DNA,Drug,Text,,,1622,3623;BLEOMYCIN,,,,,,,,76591000,,,,,,,,,,,,,,
bc0918fc-3496-426c-bfd5-ef466e9776db,,VINCRISTINE SULPHATE,Vincristine,A chemotherapeutic drug used to treat various conditions including Kaposi's sarcoma and lymphoma,Drug,Text,,,,3624;VINCRISTINE SULPHATE,,,,,,,,,,,,,,,,,,,,,,
1fc083a8-2edc-4b5e-982c-f263720b5857,,PACLITAXEL,,,Drug,Text,,,,3625;PACLITAXEL,,,,,,56946.0,,67735003,,,,,,,,,,,,,,
f4bbc611-4e6e-4c03-b3d8-0af6f081223b,,GRISEOFULVIN,,Anti-fungal medication for animals and humans for the treatment of ringworm infections of skin and nails.,Drug,Text,,,,3679;GRISEOFULVIN,,,,,,,,,,,,,,,,,,,,,,
07429704-a679-428d-832e-80b0227206f1,,ACETAZOLAMIDE,,"A carbonic anhydrase inhibitor that is used to treat glaucoma, epileptic seizures, benign intracranial hypertension (pseudotumor cerebri), altitude sickness, cystinuria, and dural ectasia.",Drug,Text,,,,4031;ACETAZOLAMIDE,,,,,,,,,,,,,,,,,,,,,,
6e8ef269-d2bd-4b1e-a07c-616f7574bcaa,,ADRENALINE,,"A hormone and neurotransmitter, used as a drug to treat cardiac arrest and other cardiac dysrhythmias resulting in diminished or absent cardiac output, anaphylaxis, sepsis and as a bronchodilator for asthma.",Drug,Text,,,,4032;ADRENALINE,,,,,,,,,,,,,,,,,,,,,,
4c5ecefd-ec41-4b6a-8b71-0ac108f15bc4,,ATROPINE SULPHATE,,"Compound of atropine, a tropane alkaloid extracted from deadly plants of the family Solanceae.  A competitive antagonist for the muscarinic acetylcholine receptor, it serves as a drug with a wide variety of effects.",Drug,Text,,,,4033;ATROPINE SULPHATE,,,,,,,,,,,,,,,,,,,,,,
4aa4bd2a-b606-4a5d-ba66-10b069730bf3,,BENZATHINE PENICILLIN,,"A form of penicillin, slowly absorbed into the circulation after intramuscular injection.  Useful when prolonged low concentrations of benzylpenicillin are required and appropriate.",Drug,Text,,,,4034;BENZATHINE PENICILLIN,,,,,,,,,,,,,,,,,,,,,,
b2577093-a11b-402a-be6a-33cc93db4fe4,,CALCIUM GLUCONATE,,A mineral supplement and the form of calcium most widely used in the treatment of hypocalcemia.,Drug,Text,,,,4035;CALCIUM GLUCONATE,,,,,,,,,,,,,,,,,,,,,,
450f614f-1cf7-4f5a-a9f9-83c5d15e028e,,DEXAMETHAZONE SODIUM PHOSPHATE,,"A topical steroid, used to treat many inflammatory and autoimmune conditions, e.g., rheumatoid arthritis.",Drug,Text,,,,4036;DEXAMETHAZONE SODIUM PHOSPHATE,,,,,,,,,,,,,,,,,,,,,,
f8362b83-2c6a-438a-ac77-066fd06932ce,,DEXTROSE,,Blood sugar.,Drug,Text,,,,4037;DEXTROSE,,,,,,,,,,,,,,,,,,,,,,
6eea54e7-5238-4113-bd9c-062873c93be0,,HYDROCORTISONE SODIUM SUCCINATE,,"A hormone that increases blood pressure and blood sugar, and reduces immune responses.",Drug,Text,,,,4038;HYDROCORTISONE SODIUM SUCCINATE,,,,,,,,,,,,,,,,,,,,,,
4d7851f4-9f21-4454-b78a-c3aa3f79b69a,,LIDOCAINE,,"A common local anesthetic and antiarrhythmic drug. Lidocaine is used topically to relieve itching, burning and pain from skin inflammations, injected as a dental anesthetic, and in minor surgery",Drug,Text,,,,4039;LIDOCAINE,,,,,,,,,,,,,,,,,,,,,,
1be2a757-ab85-4504-aaf5-7aef81b6e091,,LOFEMENOL,,Monophasic oral contraceptive.,Drug,Text,,,,4040;LOFEMENOL,,,,,,,,,,,,,,,,,,,,,,
15280607-5425-433c-b57b-397c1ee94f21,,ASCORBIC ACID,,Sugar acid with antioxident properties.,Drug,Text,,,,4041;ASCORBIC ACID,,,,,,,,,,,,,,,,,,,,,,
1349756d-e133-4188-860b-689e6473f790,,BISACODYL,,A stimulant laxative drug. It is typically prescribed for relief of constipation and for the management of neurogenic bowel dysfunction.,Drug,Text,,,,4042;BISACODYL,,,,,,,,,,,,,,,,,,,,,,
49718515-7860-4404-bf25-d93fcaf4e8a9,,CLINDAMYCIN,,"A lincosamide antibiotic. It is usually used to treat infections with anaerobic bacteria but can also be used to treat some protozoal diseases, such as malaria. It is a common topical treatment for acne, and can be useful against some methicillin-resistant Staphylococcus aureus (MRSA) infections.",Drug,Text,,,,4043;CLINDAMYCIN,,,,,,,,,,,,,,,,,,,,,,
9548e221-8dc2-40a6-993e-4126819eacdf,,CONJUGATED ESTROGEN,,"Compound used for hormone replacement therapy, typically in menopausal women.",Drug,Text,,,,4044;CONJUGATED ESTROGEN,,,,,,,,,,,,,,,,,,,,,,
00506553-0549-4e34-8c7c-af4095adc420,,FLUOXETINE,,An antidepressant of the selective serotonin reuptake inhibitor (SSRI) class.,Drug,Text,,,,4045;FLUOXETINE,,,,,,,,,,,,,,,,,,,,,,
0084d7bd-a40f-44fb-bd18-2a1853d03ee8,,GLIBENCLAMIDE,,An anti-diabetic drug in a class of medications known as sulfonylureas.,Drug,Text,,,,4046;GLIBENCLAMIDE,,,,,,,,,,,,,,,,,,,,,,
69562047-dc02-4fd2-aebe-fae338929a81,,HALOPERIDOL,,"A typical antipsychotic. It is in the butyrophenone class of antipsychotic medications and has pharmacological effects similar to the phenothiazines.  Haloperidol is a primitive antipsychotic used in the treatment of schizophrenia and, more acutely, in the treatment of acute psychotic states and delirium.",Drug,Text,,,,4047;HALOPERIDOL,,,,,,,,,,,,,,,,,,,,,,
dad23bd8-9c3b-4784-bc24-e188a0577519,,IVERMECTIN,,"A broad-spectrum antiparasitic medication, traditionally used against worms (except tapeworms), also found to be effective against most mites and some lice too.",Drug,Text,,,,4048;IVERMECTIN,,,,,,,,,,,,,,,,,,,,,,
228e97de-d363-47cf-8570-d3f6e0f3a78d,,LEVODOPA + CARBIDOPA ,,The combination of carbidopa and levodopa is used to treat Parkinson's disease and Dopa-Responsive Dystonia (DRD).,Drug,Text,,,,4049;LEVODOPA + CARBIDOPA,,,,,,,,,,,,,,,,,,,,,,
85125b81-084f-46cd-9fde-60cbae8792c3,,LEVOTHYROXINE,,A synthetic form of thyroxine (thyroid hormone).,Drug,Text,,,,4050;LEVOTHYROXINE,,,,,,,,,,,,,,,,,,,,,,
3bfb438e-c689-4005-bc53-c73181d3ace4,,LUMEFANTRINE + ARTHEMETHER,,A drug combination effective in treating malaria.,Drug,Text,,,,4051;LUMEFANTRINE + ARTHEMETHER,,,,,,,,,,,,,,,,,,,,,,
09c64c66-11d5-4fac-8848-9fd33206fefd,,METFORMIN,,An oral anti-diabetic drug from the biguanide class.,Drug,Text,,,,4052;METFORMIN,,,,,,,,,,,,,,,,,,,,,,
8f640be0-2810-4758-a12c-7575db51ffe8,,MORPHINE SULPHATE,,"A highly potent opiate analgesic drug.  Acts directly on the central nervous system (CNS) to relieve pain, and at synapses of the nucleus accumbens in particular. Morphine is highly addictive; tolerance, physical and psychological dependence develop rapidly.",Drug,Text,,,,4053;MORPHINE SULPHATE,,,,,,,,,,,,,,,,,,,,,,
9776e92a-817b-4188-a36d-1ee9371a69a1,,NEOMYCIN SULPHATE + BACITRACIN ZINC,,"Antibacterial agents, typically used for eye infections life conjunctivitis.",Drug,Text,,,,4054;NEOMYCIN SULPHATE + BACITRACIN ZINC,,,,,,,,,,,,,,,,,,,,,,
adb1387e-3c9d-4419-92b3-50c6e733e1ba,,NICOTINAMIDE,,"A water-soluble vitamin, part of the vitamin B group.",Drug,Text,,,,4055;NICOTINAMIDE,,,,,,,,,,,,,,,,,,,,,,
6bdd82c3-a3bb-476a-9a30-ce0575eb28cb,,NITROFURANTOIN,,An antibiotic. It is usually used in treating urinary tract infection.,Drug,Text,,,,4056;NITROFURANTOIN,,,,,,,,,,,,,,,,,,,,,,
6c388890-fe4b-4b87-ba38-8a6a7f6253b0,,POTASSIUM CHLORIDE,KCl,A metal halide salt composed of potassium and chlorine.,Drug,Text,,,,4057;POTASSIUM CHLORIDE,,,,,,,,,,,,,,,,,,,,,,
bfc9c532-b7c6-4c94-829b-7d690f15989f,,PRAZIQUANTEL,,An anthelmintic effective against flatworms.,Drug,Text,,,,4058;PRAZIQUANTEL,,,,,,,,,,,,,,,,,,,,,,
5f0cbcee-859e-464f-b2b2-1410aa277053,,PROMETHAZINE,,"A first-generation H1 receptor antagonist, antihistamine and antiemetic medication.",Drug,Text,,,,4059;PROMETHAZINE,,,,,,8745.0,,322154000;8372007,,,,,,,,,,,,,,
1a0709b5-006c-49b5-90bc-697c8567d0ee,,SODIUM VALPROATE,,"The sodium salt of valproic acid and is an anticonvulsant used in the treatment of epilepsy and bipolar disorder, as well as other psychiatric conditions requiring the administration of a mood stabilizer",Drug,Text,,,,4060;SODIUM VALPROATE,,,,,,,,,,,,,,,,,,,,,,
87e3a4af-ccf8-4211-9b1c-5f52f7d3e58b,,SPIRONOLACTONE,,A diuretic and is used as an antiandrogen.,Drug,Text,,,,4061;SPIRONOLACTONE,,,,,,,,,,,,,,,,,,,,,,
53ed50e2-d3b6-4166-963d-7a6d7d8c17e8,,VALPROIC ACID,,"A chemical compound that has found clinical use as an anticonvulsant and mood-stabilizing drug, primarily in the treatment of epilepsy, bipolar disorder, and less commonly major depression.",Drug,Text,,,,4062;VALPROIC ACID,,,,,,,,,,,,,,,,,,,,,,
ed69b6e2-63c6-416d-b471-f95c9c5e8847,,VITAMIN A,,"Part of the retinyl group, essential for visual perception in the eye.",Drug,Text,,,,4063;VITAMIN A,,,,,,,,,,,,,,,,,,,,,,
745774a6-6bcc-498b-a7ba-2bf70f379ffc,,ZINC OXIDE,,A chemical compound with the formula ZnO.  ,Drug,Text,,,,4064;ZINC OXIDE,,,,,,,,,,,,,,,,,,,,,,
3ceb2c7e-26fe-102b-80cb-0017a47871b2,,INFANT FORMULA,,Describes a substance used to feed children.,Drug,Text,YES;NO,,,5254;INFANT FORMULA,,,,,5254.0,,,,,,,,,,,,,,,,,
3ceb3764-26fe-102b-80cb-0017a47871b2,,HEMOPHILUS INFLUENZA B VACCINATION,,Vaccine given for HIB.,Drug,Text,,,,5261;HEMOPHILUS INFLUENZA B VACCINATION,,,,,,,,,,,,,,,,,,,,,,
3cec4ba4-26fe-102b-80cb-0017a47871b2,,OTHER ANTIRETROVIRAL DRUG,,Generic answer to encounter form questions.. another retroviral drug not already specified in the antiretroviral set (term 1085).,Drug,Text,,,,5424;OTHER ANTIRETROVIRAL DRUG,,,,,,,,,,,,,,,,,,,,,,
3cf09cb8-26fe-102b-80cb-0017a47871b2,,UNKNOWN ANTIRETROVIRAL DRUG,,"Generic answer to a question.  Patient knows that they are on an antiretroviral medicine, but does not know the name of it, and it hasn't been specified on the encounter form.",Drug,Text,,,,5811;UNKNOWN ANTIRETROVIRAL DRUG,,,,,,,,,,,,,,,,,,,,,,
3cf0c0f8-26fe-102b-80cb-0017a47871b2,,PYRAZINAMIDE,Z,"Antituberculosis agent used to treat patients with active tuberculosis, usually in combination with other agents.",Drug,Text,,,,5829;PYRAZINAMIDE,,,,,,,,,,,,,,,,,,,,,,
3cf1022a-26fe-102b-80cb-0017a47871b2,,YELLOW FEVER VACCINATION,,Vaccine given for Yellow Fever.,Drug,Text,,,,5864;YELLOW FEVER VACCINATION,,,,,,,,,,,,,,,,,,,,,,
f0556388-6f22-45a2-9ee1-c36dda169ba2,,SPARFLOXACIN,,"Fluoroquinolone antibiotic used in the treatment of bacterial infections.  Included in DST drug options in Peru EMR, and occasionally shows up in DSTs from MSLI.",Drug,Text,,,,6129,,,,,,,,,,,,,,,,,,,,,,
1884b893-e8bf-4d38-bf35-8632eda8d62c,,MINOCYCLINE,,Used in MDR-TB Treatment,Drug,Text,,,,6360;MINOCYCLINE,,,,,,,,,,,,,,,,,,,,,,
95f1dc20-9fce-47af-a67f-7c776cabe24d,,CODEINE,,"Codeine (INN) or methylmorphine is an opiate used for its analgesic, antitussive, and antidiarrheal properties, and is useful for numbing back pain",Drug,Text,,,,6403;CODEINE,,,,,,,,,,,,,,,,,,,,,,
ac96620a-1507-47df-b2e3-c7913fa299b8,,LINEZOLID,INN,"ALSO KNOWN AS Zyvox, Zyvoxid, Zyvoxam ",Drug,Text,,,,6553;LINEZOLID,,,,,,,,,,,,,,,,,,,,,,
63a4acf0-0762-44a3-aad1-3230289ce4a7,,Tenofovir and Emtricitabine,,"It is in a category of HIV medicines called nucleoside reverse transcriptase inhibitors (NRTIs). Also known as Truvada, it prevents HIV from altering the genetic material of healthy CD4 cells. This prevents the cells from producing new virus and decreases the amount of virus in the body.",Drug,Text,,,,6635;Tenofovir and Emtricitabine,,,,,6635.0,,,,,,,,,,,,,,,,,
06793d30-bf06-469f-8ae9-c9c06a8c444b,,Tenofovir and Lamivudine,TDF+3TC,,Drug,Text,,,,6636;Tenofovir and Lamivudine,,,,,6636.0,,,,,,,,,,,,,,,,,
9231cac4-8d3d-4bf5-97a3-81ec912b1899,,Insulin 70/30,,A mixture of 70% NPH human insulin and 30% regular human insulin,Drug,Text,,,,6746;Insulin 70/30,,,,,,,,,,,,,,,,,,,,,,
98042566-aedc-442d-96b3-d055d3dd7d81,,Losartan,,Losartan is used to treat high blood pressure (hypertension).,Drug,Text,,,,6769;Losartan,,,,,,,,,,,,,,,,,,,,,,
7203ef6c-6427-4ecb-8035-2d4a3c5e1b80,,Dexamethasone,,"Dexamethasone is used to treat many inflammatory  and autoimmune conditions, such as rheumatoid arthritis.",Drug,Text,,,,6850;Dexamethasone,,,,,,,,,,,,,,,,,,,,,,
fa202316-558f-453d-babd-ba28f43a7fd9,,Insulin,,"This is a general use of insulin.  When possible, users should use the more specific -- regular, lente or 70/30 mix.",Drug,Text,,,,6872;Insulin,,,,,,,,,,,,,,,,,,,,,,
fa7ac708-b07b-4675-846e-4ac8b41ca501,,Cromoglicic acid,,This drug prevents the release of inflammatory chemicals such as histamine from mast cells.,Drug,Text,,,,6876;Cromoglicic acid,,,,,,,,,,,,,,,,,,,,,,
0cb0c5c0-1f7d-462b-9b38-371dd2354c8c,,Co-trimoxazole 120mg per day,,,Drug,Text,,,,6891;Co-trimoxazole 120mg per day,,,,,,,,,,,,,,,,,,,,,,
e1297cb4-aeaa-4c9f-9dab-546ed52c9e38,,Co-trimoxazole 240mg per day,,,Drug,Text,,,,6892;Co-trimoxazole 240mg per day,,,,,,,,,,,,,,,,,,,,,,
5024178a-fe1e-41a1-8910-e544367c5994,,Ethinylestradiol,,,Drug,Text,,,,,,,,,,,,,,,,,,,,,,,,,,
ed45fc44-dc17-4d5c-9e39-81a6c3de6657,,Ether anesthésique,,,Drug,Text,,,,,,,,,,,,,,,,,,,,,,,,,,
bd48b7f8-7b4f-4032-9e4e-57d043aa6598,,Ethrane,,,Drug,Text,,,,,,,,,,,,,,,,,,,,,,,,,,
7545ac0d-bd69-42b9-be64-760c0708936b,,SPECTINOMYCINE ,,,Drug,Text,,,,,,,,,,,,,,,,,,,,,,,,,,
029959e7-2a67-44e3-91a6-8eefe5e80569,,Oestrogen,,,Drug,Text,,,,,,,,,,,,,,,,,,,,,,,,,,
dbcb40af-a811-4390-8fb1-56a2f7362784,,Clomifene,,,Drug,Text,,,,,,,,,,,,,,,,,,,,,,,,,,
349b1be5-43b4-4742-a0d3-672aba28aa49,,VANCOMYCINE,,,Drug,Text,,,,,,,,,,,,,,,,,,,,,,,,,,
df45f982-330e-4c3b-a0e7-a8fec94dd1cc,,Bromocriptine,,,Drug,Text,,,,,,,,,,,,,,,,,,,,,,,,,,
0830ce50-587d-4c78-b142-3cbac3fb8413,,PHENOXYMETHYL PENICILLINE ,,PHENOXYMETHYL PENICILLINE ,Drug,Text,,,,,,,,,,,,,,,,,,,,,,,,,,
ed98a400-c5e7-410f-b63d-8bf3f0342459,,Norethisterone,,Norethisterone,Drug,Text,,,,,,,,,,,,,,,,,,,,,,,,,,
2ce69deb-6c16-4541-9919-3acdd57ab2b8,,Halothane,,Halothane,Drug,Text,,,,,,,,,,,,,,,,,,,,,,,,,,
652a7c15-08ec-40a7-a973-8eb92b1e2a5b,,Héparine sodique,,,Drug,Text,,,,,,,,,,,,,,,,,,,,,,,,,,
65dacc8e-b1d4-44fa-9172-919dade92598,,Kétamine,,,Drug,Text,,,,,,,,,,,,,,,,,,,,,,,,,,
6b187926-003e-41d6-a4a6-210bca9851e8,,Potassium iodide,,,Drug,Text,,,,,,,,,,,,,,,,,,,,,,,,,,
104b8c07-4941-419e-ab48-0a496628aff4,,Dextran 70,,,Drug,Text,,,,,,,,,,,,,,,,,,,,,,,,,,
ce053dc1-14c8-463d-93ef-f0245e9c3054,,Oxygene,,,Drug,Text,,,,,,,,,,,,,,,,,,,,,,,,,,
f265c67a-6e85-4ef9-90a9-25940d6da6d6,,Propylthiouracile,,,Drug,Text,,,,,,,,,,,,,,,,,,,,,,,,,,
81ce5616-7a34-4176-8097-ab7191f05df9,,ANTITUBERCULEUX ,,,Drug,Text,,,,,,,,,,,,,,,,,,,,,,,,,,
1970a6b7-2241-4193-b80e-dde09ced6d82,,Neomercazol,,Neomercazol,Drug,Text,,,,,,,,,,,,,,,,,,,,,,,,,,
559238e4-7d49-4796-9067-374c97f24ce7,,Protoxyde d’azote,,,Drug,Text,,,,,,,,,,,,,,,,,,,,,,,,,,
ffc55f44-ae46-43fa-92a8-9a38eea1a61d,,Gliclazide,,,Drug,Text,,,,,,,,,,,,,,,,,,,,,,,,,,
2599167a-88da-41ae-b13b-a14ac238df9e,,Insuline lente,,,Drug,Text,,,,,,,,,,,,,,,,,,,,,,,,,,
4144c906-1aae-4553-8dc4-52a0dc4a8050,,VENOSMIL,,,Drug,Text,,,,,,,,,,,,,,,,,,,,,,,,,,
ced64389-f589-4183-8970-613b5ea3c23a,,Thiopental,,,Drug,Text,,,,,,,,,,,,,,,,,,,,,,,,,,
120a8bcd-bf72-43ee-8a4c-474d8b7b3faf,,Insuline d’action intermédiaire,,,Drug,Text,,,,,,,,,,,,,,,,,,,,,,,,,,
3db15351-186f-4e4a-abff-74927dae760e,,Insuline d’action rapide,,,Drug,Text,,,,,,,,,,,,,,,,,,,,,,,,,,
efa6003a-9416-4ff0-8c23-577570ef7ad2,,Bupivacaïne,,,Drug,Text,,,,,,,,,,,,,,,,,,,,,,,,,,
cb74dc6d-dccf-4ad6-941b-813ae0fc3bc9,,Amiodarone,,,Drug,Text,,,,,,,,,,,,,,,,,,,,,,,,,,
c4545fae-5f52-4e30-816a-d726d6277c62,,Metforrmine,,,Drug,Text,,,,,,,,,,,,,,,,,,,,,,,,,,
3d1a02e7-dee4-47ec-a451-a21f2d804773,,PASER GRANULE,,,Drug,Text,,,,,,,,,,,,,,,,,,,,,,,,,,
d6784388-17cd-495e-a30d-b8c6814e7aa0,,Digoxine,,,Drug,Text,,,,,,,,,,,,,,,,,,,,,,,,,,
81bd2540-7f17-4809-b1a6-67d2008fea06,,Epinéphrine (adrénaline),,,Drug,Text,,,,,,,,,,,,,,,,,,,,,,,,,,
ccd94812-827e-463f-bd00-02848fd8481e,,Propronolol,,,Drug,Text,,,,,,,,,,,,,,,,,,,,,,,,,,
ed896813-b1eb-4c7c-9fc2-551a9883293b,,diphtheria antitoxin,,,Drug,Text,,,,,,,,,,,,,,,,,,,,,,,,,,
a2b1fb38-cb5f-4270-8bd2-6ab9c7a7713f,,rabies immune globulin,,,Drug,Text,,,,,,,,,,,,,,,,,,,,,,,,,,
46e715f3-a745-430b-a33f-e9568d6bc9d6,,Clonidine,,,Drug,Text,,,,,,,,,,,,,,,,,,,,,,,,,,
6b0bf7c3-eb4d-45bc-899a-548b3345fc0d,,Tetanus human immunoglobulin,,,Drug,Text,,,,,,,,,,,,,,,,,,,,,,,,,,
149e92f6-510b-4bae-a268-c7665ff851ab,,Human immunoglobulin anti-D,,,Drug,Text,,,,,,,,,,,,,,,,,,,,,,,,,,
ce185231-da42-46e5-9b4e-b21b154407f9,,ARTEMETHER,,,Drug,Text,,,,,,,,,,,,,,,,,,,,,,,,,,
33f717f0-1a11-4c5c-aea8-538c01050f56,,antivenoms,,,Drug,Text,,,,,,,,,,,,,,,,,,,,,,,,,,
4ee4168e-a7b5-4e97-8358-79b58dc0fb49,,Cartouche dentaire,,Cartouche dentaire,Drug,Text,,,,,,,,,,,,,,,,,,,,,,,,,,
1a90ea7f-ca8a-45f7-b874-f4600989c5c7,,Acetylsalicylic Acid v2,,,Drug,Text,,,,,,,,,,,,,,,,,,,,,,,,,,
9d014466-f4c5-4ae6-92c6-160d01344d72,,Heparine,,,Drug,Text,,,,,,,,,,,,,,,,,,,,,,,,,,
ba238e76-2487-4405-9f11-600220423ffb,,Nadroparine,,,Drug,Text,,,,,,,,,,,,,,,,,,,,,,,,,,
180cc3b8-1f08-4a4d-a89d-5b9dc3d91683,,MELARSOPROL,,,Drug,Text,,,,,,,,,,,,,,,,,,,,,,,,,,
23ca9c81-f8c0-4d26-8c36-5ae8376becf6,,DTP-HepB + Hib,,,Drug,Text,,,,,,,,,,,,,,,,,,,,,,,,,,
10cd6191-75d5-474b-a824-8e4779d5f258,,Mannitol,,,Drug,Text,,,,,,,,,,,,,,,,,,,,,,,,,,
ac4dd5d6-f4a9-4e39-90f0-5dcd4c8d9308,,SURAMINE ,,,Drug,Text,,,,,,,,,,,,,,,,,,,,,,,,,,
9622b3e9-4f18-4209-b9ad-743308bce1cb,,POTASSIUM PERMANGANATE,,POTASSIUM PERMANGANATE,Drug,Text,,,,,,,,,,,,,,,,,,,,,,,,,,
af4cd475-db8c-4e25-b92c-f85dbb427702,,Sulfadiazine argentique,,,Drug,Text,,,,,,,,,,,,,,,,,,,,,,,,,,
a9d5972f-391d-46c9-bf8b-537019030ef2,,éosine,,,Drug,Text,,,,,,,,,,,,,,,,,,,,,,,,,,
853e3532-304e-4905-9fa3-b49b92fdc0bd,,Chloramine,,Chloramine,Drug,Text,,,,,,,,,,,,,,,,,,,,,,,,,,
4d54c0fc-5980-441c-87bc-d9b3e7efefe9,,T.T(antitetanique),,,Drug,Text,,,,,,,,,,,,,,,,,,,,,,,,,,
8597292a-a826-4e4d-96f8-86c57d631ef2,,Chlorhexidine,,,Drug,Text,,,,,,,,,,,,,,,,,,,,,,,,,,
46754981-7c66-4185-a2ae-4a3511ecde21,,Peroxyde d’hydrogène,,,Drug,Text,,,,,,,,,,,,,,,,,,,,,,,,,,
a55fe2f8-33d9-4624-a5b7-b66e3eaf3997,,Acide borique,,,Drug,Text,,,,,,,,,,,,,,,,,,,,,,,,,,
5e9ace83-9f42-43e5-9708-a3448cc33394,,Vaccin antiméningococcique,,,Drug,Text,,,,,,,,,,,,,,,,,,,,,,,,,,
9cdeaf51-12dc-4cac-ba45-4bd63bad385f,,Ephédrine,,,Drug,Text,,,,,,,,,,,,,,,,,,,,,,,,,,
e3178626-c6af-4e14-b43e-07ded241e635,,CYCLOPHOSPHAMIDE,,,Drug,Text,,,3002;7652;Cyclophosphamide,,,74120.0,,,,,,74470007,,,,,,,,,,,,,,
08828b11-7af2-47ce-b26d-3d8572d7964a,,Vaccin antirabique inactivé,,,Drug,Text,,,,,,,,,,,,,,,,,,,,,,,,,,
f623e5a4-03da-47f1-916f-8f96c3db1593,,Cétrimide,,,Drug,Text,,,,,,,,,,,,,,,,,,,,,,,,,,
21ea942e-ca15-435a-bae8-7b02c17cdf73,,Ethanol(Désinfectant),,,Drug,Text,,,,,,,,,,,,,,,,,,,,,,,,,,
caa7d418-ebd8-4338-9182-3e6095b9bb70,,Polyvidone iodée,,,Drug,Text,,,,,,,,,,,,,,,,,,,,,,,,,,
23b6dc83-9ce3-4f14-bb3f-bc09812ccffb,,OPV ,,,Drug,Text,,,,,,,,,,,,,,,,,,,,,,,,,,
0db83c63-e77e-49fe-bf9c-9907fa3ee697,,Sulfate de néomycine + Bacitracine,,,Drug,Text,,,,,,,,,,,,,,,,,,,,,,,,,,
f0347a75-d075-4453-b9aa-4a58d10d4ce9,,K-Y,,,Drug,Text,,,,,,,,,,,,,,,,,,,,,,,,,,
b3053b6b-fd9b-4203-9193-d2a389d7c46c,,Antipneumocoquesl (PCV-7),,,Drug,Text,,,,,,,,,,,,,,,,,,,,,,,,,,
7d623ef0-eb87-4195-8933-236b73629fb4,,Fucidic Acid,,"Fusidic acid is a bacteriostatic antibiotic that is often used topically in creams and eyedrops, but may also be given systemically as tablets or injections",Drug,Text,,,,,,,,,,,,,,,,,,,,,,,,,,
eef52d7f-aa4c-401c-a41f-69afb579dcde,,Alcuronium,,,Drug,Text,,,,,,,,,,,,,,,,,,,,,,,,,,
63a3037b-9d46-47ad-adf7-42f8de2d36c8,,Sulfure de sélénium,,,Drug,Text,,,,,,,,,,,,,,,,,,,,,,,,,,
59a6aaf5-28ed-40b7-b397-3a8b4ca7fd7b,,HYDROCORTISONE+OXYTETRACYLINE,,,Drug,Text,,,,,,,,,,,,,,,,,,,,,,,,,,
0fd45ca9-e5e7-4c20-b762-97db86bce5a7,,Benzoate de benzyle,,,Drug,Text,,,,,,,,,,,,,,,,,,,,,,,,,,
21943c96-5253-49d0-bb37-179c0dec7828,,Néostigmine,,Néostigmine,Drug,Text,,,,,,,,,,,,,,,,,,,,,,,,,,
8c267df2-b784-4b07-95ad-fe73b68c784f,,Perméthrine,,,Drug,Text,,,,,,,,,,,,,,,,,,,,,,,,,,
4210afa4-e69f-4896-96ed-abe3fd53eabc,,BETHAMETASONE+CLOTRIMAZOLE+GENTAMYCINE,,,Drug,Text,,,,,,,,,,,,,,,,,,,,,,,,,,
4dfc7870-7f63-4173-bf5d-06e46a25e955,,Béthametasone Diproprionate,,,Drug,Text,,,,,,,,,,,,,,,,,,,,,,,,,,
55ee3028-892e-4432-b18e-dd0f9d55dfa4,,Béthametasone Valérate,,,Drug,Text,,,,,,,,,,,,,,,,,,,,,,,,,,
02a2e91c-b471-4cb0-b5d0-81d3fc81fc86,,Hydrocortisone acétate,,,Drug,Text,,,,,,,,,,,,,,,,,,,,,,,,,,
b345ff5e-79e9-4e30-b68f-c52a3fc8f9b2,,Miconazole Nitrate + Hydrocortisone,,,Drug,Text,,,,,,,,,,,,,,,,,,,,,,,,,,
07135c52-b291-4e1d-86c3-163dbb106e27,,Bethamethasone diproprionale + ac. Salicylique,,,Drug,Text,,,,,,,,,,,,,,,,,,,,,,,,,,
885ff2ca-94b5-4fa7-987a-ac5ee6d0ec2b,,PEROXYDE DE BENZOYLE,,,Drug,Text,,,,,,,,,,,,,,,,,,,,,,,,,,
d631396d-2308-4d86-b936-bbb42350411b,,Pyridostigmine,,,Drug,Text,,,,,,,,,,,,,,,,,,,,,,,,,,
e2f8d80b-b21f-4362-aea3-0e9ed167b7ff,,Phytoménadione,,,Drug,Text,,,,,,,,,,,,,,,,,,,,,,,,,,
8a715b9b-e3e5-406d-8e46-6a859bfa993b,,DITRANOL,,,Drug,Text,,,,,,,,,,,,,,,,,,,,,,,,,,
